
<!ELEMENT agenda (contacto+)>
<!ELEMENT contacto (nombre, apellidos, direccion, telefono+)>
<!ELEMENT nombre (#PCDATA) >
<!ELEMENT apellidos (#PCDATA) >
<!ELEMENT direccion (#PCDATA) >
<!ELEMENT telefono (telefono+) >

<!ATTLIST nombre orden CDATA #REQUIRED >